{
  "schema_version": 1,
  "measurement_id": "c42da6d5-f707-4384-ab48-1930fea838a5",
  "measurement_token": "ADFcmehC431XArUxy-RlyHxhbfdQBavn",
  "captured_at": "2026-08-04T03:47:52.187Z",
  "method": "POST",
  "url": "/capture/ajax?token=ADFcmehC431XArUxy-RlyHxhbfdQBavn",
  "http_version": "2.0",
  "alpn": "h2",
  "headers": {
    ":method": "POST",
    ":path": "/capture/ajax?token=ADFcmehC431XArUxy-RlyHxhbfdQBavn",
    ":authority": "app.test",
    ":scheme": "https",
    "user-agent": "Mozilla/5.0 (X11; Linux x86_64; rv:153.0) Gecko/20100101 Firefox/153.0",
    "accept": "*/*",
    "accept-language": "en-US,en;q=0.9",
    "accept-encoding": "gzip, deflate, br, zstd",
    "referer": "https://app.test/scenario/ajax?token=ADFcmehC431XArUxy-RlyHxhbfdQBavn",
    "content-type": "application/json",
    "content-length": "27",
    "origin": "https://app.test",
    "sec-fetch-dest": "empty",
    "sec-fetch-mode": "cors",
    "sec-fetch-site": "same-origin",
    "priority": "u=4",
    "te": "trailers"
  },
  "raw_headers": [
    ":method",
    "POST",
    ":path",
    "/capture/ajax?token=ADFcmehC431XArUxy-RlyHxhbfdQBavn",
    ":authority",
    "app.test",
    ":scheme",
    "https",
    "user-agent",
    "Mozilla/5.0 (X11; Linux x86_64; rv:153.0) Gecko/20100101 Firefox/153.0",
    "accept",
    "*/*",
    "accept-language",
    "en-US,en;q=0.9",
    "accept-encoding",
    "gzip, deflate, br, zstd",
    "referer",
    "https://app.test/scenario/ajax?token=ADFcmehC431XArUxy-RlyHxhbfdQBavn",
    "content-type",
    "application/json",
    "content-length",
    "27",
    "origin",
    "https://app.test",
    "sec-fetch-dest",
    "empty",
    "sec-fetch-mode",
    "cors",
    "sec-fetch-site",
    "same-origin",
    "priority",
    "u=4",
    "te",
    "trailers"
  ]
}
