{
  "schema_version": 1,
  "measurement_id": "276379f4-499f-467e-8924-926f2bffca14",
  "measurement_token": "_VeMjK2qkpd3D-5K3RCbFqDDoU9kEn_J",
  "captured_at": "2026-08-04T03:48:07.021Z",
  "method": "POST",
  "url": "/capture/form?token=_VeMjK2qkpd3D-5K3RCbFqDDoU9kEn_J",
  "http_version": "2.0",
  "alpn": "h2",
  "headers": {
    ":method": "POST",
    ":authority": "app.test",
    ":scheme": "https",
    ":path": "/capture/form?token=_VeMjK2qkpd3D-5K3RCbFqDDoU9kEn_J",
    "content-length": "21",
    "cache-control": "max-age=0",
    "sec-ch-ua": "\"Not;A=Brand\";v=\"8\", \"Chromium\";v=\"150\", \"Microsoft Edge\";v=\"150\"",
    "sec-ch-ua-mobile": "?0",
    "sec-ch-ua-platform": "\"Windows\"",
    "upgrade-insecure-requests": "1",
    "content-type": "application/x-www-form-urlencoded",
    "user-agent": "Mozilla/5.0 (Windows NT 10.0; Win64; x64) AppleWebKit/537.36 (KHTML, like Gecko) HeadlessChrome/150.0.0.0 Safari/537.36 Edg/150.0.0.0",
    "origin": "https://app.test",
    "accept": "text/html,application/xhtml+xml,application/xml;q=0.9,image/avif,image/webp,image/apng,*/*;q=0.8,application/signed-exchange;v=b3;q=0.7",
    "sec-fetch-site": "same-origin",
    "sec-fetch-mode": "navigate",
    "sec-fetch-user": "?1",
    "sec-fetch-dest": "document",
    "referer": "https://app.test/scenario/form?token=_VeMjK2qkpd3D-5K3RCbFqDDoU9kEn_J",
    "accept-encoding": "gzip, deflate, br, zstd",
    "accept-language": "en-US,en;q=0.9",
    "priority": "u=0, i"
  },
  "raw_headers": [
    ":method",
    "POST",
    ":authority",
    "app.test",
    ":scheme",
    "https",
    ":path",
    "/capture/form?token=_VeMjK2qkpd3D-5K3RCbFqDDoU9kEn_J",
    "content-length",
    "21",
    "cache-control",
    "max-age=0",
    "sec-ch-ua",
    "\"Not;A=Brand\";v=\"8\", \"Chromium\";v=\"150\", \"Microsoft Edge\";v=\"150\"",
    "sec-ch-ua-mobile",
    "?0",
    "sec-ch-ua-platform",
    "\"Windows\"",
    "upgrade-insecure-requests",
    "1",
    "content-type",
    "application/x-www-form-urlencoded",
    "user-agent",
    "Mozilla/5.0 (Windows NT 10.0; Win64; x64) AppleWebKit/537.36 (KHTML, like Gecko) HeadlessChrome/150.0.0.0 Safari/537.36 Edg/150.0.0.0",
    "origin",
    "https://app.test",
    "accept",
    "text/html,application/xhtml+xml,application/xml;q=0.9,image/avif,image/webp,image/apng,*/*;q=0.8,application/signed-exchange;v=b3;q=0.7",
    "sec-fetch-site",
    "same-origin",
    "sec-fetch-mode",
    "navigate",
    "sec-fetch-user",
    "?1",
    "sec-fetch-dest",
    "document",
    "referer",
    "https://app.test/scenario/form?token=_VeMjK2qkpd3D-5K3RCbFqDDoU9kEn_J",
    "accept-encoding",
    "gzip, deflate, br, zstd",
    "accept-language",
    "en-US,en;q=0.9",
    "priority",
    "u=0, i"
  ]
}
