{
  "schema_version": 1,
  "measurement_id": "c1e93050-e9fb-4598-98a0-ef1dcb4f3ea0",
  "measurement_token": "okPCM6QF5FoFqEw6vlBvFw0ihiDQRMQ5",
  "captured_at": "2026-08-04T03:47:53.919Z",
  "method": "POST",
  "url": "/capture/ajax?token=okPCM6QF5FoFqEw6vlBvFw0ihiDQRMQ5",
  "http_version": "2.0",
  "alpn": "h2",
  "headers": {
    ":method": "POST",
    ":authority": "app.test",
    ":scheme": "https",
    ":path": "/capture/ajax?token=okPCM6QF5FoFqEw6vlBvFw0ihiDQRMQ5",
    "content-length": "27",
    "sec-ch-ua-platform": "\"Windows\"",
    "user-agent": "Mozilla/5.0 (Windows NT 10.0; Win64; x64) AppleWebKit/537.36 (KHTML, like Gecko) HeadlessChrome/150.0.0.0 Safari/537.36",
    "sec-ch-ua": "\"Not;A=Brand\";v=\"8\", \"Chromium\";v=\"150\", \"Google Chrome\";v=\"150\"",
    "content-type": "application/json",
    "sec-ch-ua-mobile": "?0",
    "accept": "*/*",
    "origin": "https://app.test",
    "sec-fetch-site": "same-origin",
    "sec-fetch-mode": "cors",
    "sec-fetch-dest": "empty",
    "referer": "https://app.test/scenario/ajax?token=okPCM6QF5FoFqEw6vlBvFw0ihiDQRMQ5",
    "accept-encoding": "gzip, deflate, br, zstd",
    "accept-language": "en-US,en;q=0.9",
    "priority": "u=1, i"
  },
  "raw_headers": [
    ":method",
    "POST",
    ":authority",
    "app.test",
    ":scheme",
    "https",
    ":path",
    "/capture/ajax?token=okPCM6QF5FoFqEw6vlBvFw0ihiDQRMQ5",
    "content-length",
    "27",
    "sec-ch-ua-platform",
    "\"Windows\"",
    "user-agent",
    "Mozilla/5.0 (Windows NT 10.0; Win64; x64) AppleWebKit/537.36 (KHTML, like Gecko) HeadlessChrome/150.0.0.0 Safari/537.36",
    "sec-ch-ua",
    "\"Not;A=Brand\";v=\"8\", \"Chromium\";v=\"150\", \"Google Chrome\";v=\"150\"",
    "content-type",
    "application/json",
    "sec-ch-ua-mobile",
    "?0",
    "accept",
    "*/*",
    "origin",
    "https://app.test",
    "sec-fetch-site",
    "same-origin",
    "sec-fetch-mode",
    "cors",
    "sec-fetch-dest",
    "empty",
    "referer",
    "https://app.test/scenario/ajax?token=okPCM6QF5FoFqEw6vlBvFw0ihiDQRMQ5",
    "accept-encoding",
    "gzip, deflate, br, zstd",
    "accept-language",
    "en-US,en;q=0.9",
    "priority",
    "u=1, i"
  ]
}
