{
  "schema_version": 1,
  "measurement_id": "7d2a7d92-f463-43cf-89b0-5718110ccfe2",
  "measurement_token": "eNP5nqNxEEB9qiBlueJC3buOfmuICwM4",
  "captured_at": "2026-08-04T03:47:53.384Z",
  "method": "GET",
  "url": "/capture/navigation?token=eNP5nqNxEEB9qiBlueJC3buOfmuICwM4",
  "http_version": "2.0",
  "alpn": "h2",
  "headers": {
    ":method": "GET",
    ":authority": "app.test",
    ":scheme": "https",
    ":path": "/capture/navigation?token=eNP5nqNxEEB9qiBlueJC3buOfmuICwM4",
    "sec-ch-ua": "\"Not;A=Brand\";v=\"8\", \"Chromium\";v=\"150\", \"Google Chrome\";v=\"150\"",
    "sec-ch-ua-mobile": "?0",
    "sec-ch-ua-platform": "\"Windows\"",
    "upgrade-insecure-requests": "1",
    "user-agent": "Mozilla/5.0 (Windows NT 10.0; Win64; x64) AppleWebKit/537.36 (KHTML, like Gecko) HeadlessChrome/150.0.0.0 Safari/537.36",
    "accept": "text/html,application/xhtml+xml,application/xml;q=0.9,image/avif,image/webp,image/apng,*/*;q=0.8,application/signed-exchange;v=b3;q=0.7",
    "sec-fetch-site": "none",
    "sec-fetch-mode": "navigate",
    "sec-fetch-user": "?1",
    "sec-fetch-dest": "document",
    "accept-encoding": "gzip, deflate, br, zstd",
    "accept-language": "en-US,en;q=0.9",
    "priority": "u=0, i"
  },
  "raw_headers": [
    ":method",
    "GET",
    ":authority",
    "app.test",
    ":scheme",
    "https",
    ":path",
    "/capture/navigation?token=eNP5nqNxEEB9qiBlueJC3buOfmuICwM4",
    "sec-ch-ua",
    "\"Not;A=Brand\";v=\"8\", \"Chromium\";v=\"150\", \"Google Chrome\";v=\"150\"",
    "sec-ch-ua-mobile",
    "?0",
    "sec-ch-ua-platform",
    "\"Windows\"",
    "upgrade-insecure-requests",
    "1",
    "user-agent",
    "Mozilla/5.0 (Windows NT 10.0; Win64; x64) AppleWebKit/537.36 (KHTML, like Gecko) HeadlessChrome/150.0.0.0 Safari/537.36",
    "accept",
    "text/html,application/xhtml+xml,application/xml;q=0.9,image/avif,image/webp,image/apng,*/*;q=0.8,application/signed-exchange;v=b3;q=0.7",
    "sec-fetch-site",
    "none",
    "sec-fetch-mode",
    "navigate",
    "sec-fetch-user",
    "?1",
    "sec-fetch-dest",
    "document",
    "accept-encoding",
    "gzip, deflate, br, zstd",
    "accept-language",
    "en-US,en;q=0.9",
    "priority",
    "u=0, i"
  ]
}
